{"$id":"https://agent-development-skills.local/design/design-agent-packet-v1.schema.json","$schema":"https://json-schema.org/draft/2020-12/schema","additionalProperties":false,"properties":{"fingerprint":{"pattern":"^design-v1:[0-9a-f]{64}$","type":"string"},"ir_slice":{"minProperties":1,"type":"object"},"packet_id":{"minLength":1,"type":"string"},"registry_slice":{"minProperties":1,"type":"object"},"schema_version":{"const":"1.0"},"source_fingerprints":{"items":{"pattern":"^design-v1:[0-9a-f]{64}$","type":"string"},"minItems":1,"type":"array","uniqueItems":true},"stale_inputs":{"items":{"minLength":1,"type":"string"},"type":"array","uniqueItems":true},"task_scope":{"additionalProperties":false,"properties":{"id":{"minLength":1,"type":"string"},"kind":{"enum":["screen","region","component"]}},"required":["kind","id"],"type":"object"},"unknowns":{"items":{"additionalProperties":false,"properties":{"blocking":{"type":"boolean"},"id":{"minLength":1,"type":"string"},"reason":{"minLength":1,"type":"string"}},"required":["id","reason","blocking"],"type":"object"},"type":"array"}},"required":["schema_version","packet_id","task_scope","source_fingerprints","ir_slice","registry_slice","unknowns","stale_inputs","fingerprint"],"title":"Design Agent Packet v1","type":"object"}
