{"fingerprint":"design-v1:eb16dcb89eb14d7bb753854526bf7ba16add27896e0db6d8a0b4dab5a38dd65f","ir_slice":{"id":"save-button","regions":[{"components":[{"id":"save-button","provenance":{"confidence":1.0,"evidence_ref":"evidence-80a00c9e42a17c9a","kind":"source"},"slots":{"label":"Save"},"states":["default","disabled","pressed"],"token_refs":["color.action.primary"],"type":"button","variant":"primary"}],"id":"task-slice","layout":{"kind":"slice"}}],"states":[]},"packet_id":"packet-a0b4dab5a38dd65f","registry_slice":{"components":{"button":{"motion":{},"slots":["label"],"states":["default","disabled","pressed"],"token_refs":["color.action.primary"],"variants":["primary"]}},"registry_id":"shared-default","tokens":{"color.action.primary":{"semantic":"action-primary"}},"version":"1.0.0"},"schema_version":"1.0","source_fingerprints":["design-v1:99655a49b4d2690240780ac983d58648e38aad20648a733dff6dd18a07c7bca5","design-v1:b7fe65f0103bfaa6300375a48262b36584f42f4ebe5dedccd7af0bd6c6f66fab"],"stale_inputs":[],"task_scope":{"id":"save-button","kind":"component"},"unknowns":[]}
